{
  "schema": "canvasbench.task.v2",
  "id": "case-08",
  "title": "Ownership-aware delivery-rework replay",
  "description": "No-inference production replay derived from task 99894b1a and artifact 861eebff across 100 diagnostic orders.",
  "status": "runnable",
  "mode": "deterministic_replay",
  "inference_policy": "deterministic_exempt",
  "allowed_tool_policies": ["deterministic_replay"],
  "weight": 10,
  "role": "replay",
  "system_prompt": "",
  "user_message": "",
  "fixture": {
    "repo_id": "drem-orchestrator",
    "base_commit": "1d1796eb98222ca8de743730efaa5de8f9f61277",
    "visible_blobs": [
      {"path": "internal/orchestrator/delivery_rework_routing.go", "git_blob_sha": "d98e621825f96d720aab22ec452c287e881158cc"},
      {"path": "internal/orchestrator/delivery_state_test.go", "git_blob_sha": "4a57fed2b91e4364f34308be89dc5e4943fed3d1"}
    ],
    "seed_patch": "../seeds/case-08-rework-replay.patch",
    "seed_patch_sha256": "6792d5caf16b5b1ff34d87ccf138686cee599e42d622f1982f173f6beabf6ea3"
  },
  "read_paths": [],
  "write_paths": ["internal/orchestrator/canvasbench_rework_replay_test.go"],
  "required_changed_paths": ["internal/orchestrator/canvasbench_rework_replay_test.go"],
  "result_artifact": "",
  "required_mutation": false,
  "oracle_id": "ownership-rework-99894b1a-v1",
  "budget": {"max_input_tokens": 1, "max_output_tokens": 1, "max_tool_calls": 1, "max_iterations": 1, "timeout_seconds": 60}
}
