{
  "schema": "canvasbench.task.v2",
  "id": "case-06",
  "title": "Compiler-directed take-cycling artifact repair",
  "description": "Repair the exact preserved non-compiling artifact 861eebff using pinned compiler evidence and hidden behavioral verification.",
  "status": "runnable",
  "mode": "direct_worker",
  "inference_policy": "required",
  "allowed_tool_policies": ["structured_only", "sandboxed_shell"],
  "weight": 14,
  "role": "fixer",
  "system_prompt": "Repair only the declared test, header, implementation include seam, focused take-actions fragment, seeded action-handler cleanup, and action registration fragment. Restore EditorAdapterActionHandlers.inc to its pinned base content, put the private member definitions in new EditorAdapterTakeActions.inc, remove invented APIs, and align declarations/definitions/action pointers. Do not edit the keymap.",
  "user_message": "Make the preserved take-cycling artifact compile and satisfy the hidden behavioral suite without broadening scope. Implement private member takeNext(int), takePrev(int), and cycleSelectedTake(int). Do not edit the keymap.\n\nPinned Canvas base: da8d567ea85a6ffc08e7a1ec0d3d7e49802306fc\nPreserved artifact: 861eebff00cae0515ca580afb0ab101fd050de49\n\nFocused integration compile diagnostics (AppleClang 17, C++17):\n- LaneVersionCommandTest.cpp:787,807: no member named 'setSelectedTrackIndex' in 'dc::Arrangement'\n- LaneVersionCommandTest.cpp:958,980: no member named 'setInAutomationLane' in 'dc::VimContext'; did you mean 'setAutomationLaneIndex'?\n- LaneVersionCommandTest.cpp:999,1000,1009,1010: no member named 'getAction' in 'dc::ActionRegistry'\n- LaneVersionCommandTest.cpp:1018+: no member named 'Panel' in namespace 'dc'; did you mean 'dc::VimContext::Panel'?\n- LaneVersionCommandTest.cpp:1018+: KeymapRegistry::resolve expected 3 arguments, but 2 were provided\n\nFocused EditorAdapter compile diagnostics (AppleClang 17, C++17):\n- EditorAdapterActionHandlers.inc:603: no member named 'getArrangement' in 'dc::EditorAdapter'\n- EditorAdapterActionHandlers.inc:604: no member named 'getProject' in 'dc::EditorAdapter'\n- EditorAdapterActionHandlers.inc:605: no member named 'getContext' in 'dc::EditorAdapter'\n- EditorAdapterActionHandlers.inc:610,617,624,639: no member named 'setStatusMessage' in 'dc::EditorAdapter'\n- EditorAdapterActionHandlers.inc:638: no member named 'getClipLaneVersionName' in 'dc::Track'\n- EditorAdapterActionHandlers.inc:640,641: 'onContextChanged' is a protected member of 'dc::ContextAdapter'\n- EditorAdapterActionRegistration.inc:176: no member named 'takeNext' in 'dc::EditorAdapter'\n- EditorAdapterActionRegistration.inc:177: no member named 'takePrev' in 'dc::EditorAdapter'\n- EditorAdapterActionRegistration.inc:192: cannot use incomplete type 'const ActionDef[]' as a range\n",
  "fixture": {"repo_id": "drem-canvas", "base_commit": "da8d567ea85a6ffc08e7a1ec0d3d7e49802306fc", "visible_blobs": [
    {"path": "tests/integration/LaneVersionCommandTest.cpp", "git_blob_sha": "e013d01be19945e0c009ac16987f7c2b5c49b32f"},
    {"path": "src/vim/adapters/EditorAdapter.h", "git_blob_sha": "f317c4391fcf48cc4e496a06231f1661f7489871"},
    {"path": "src/vim/adapters/EditorAdapter.cpp", "git_blob_sha": "ccbda6a4d6b97265b36424412ace222c7051674b"},
    {"path": "src/vim/adapters/fragments/EditorAdapterActionHandlers.inc", "git_blob_sha": "42a9aae475fdd7cb8e8a572d3c716e3bb5f51fc6"},
    {"path": "src/vim/adapters/fragments/EditorAdapterActionRegistration.inc", "git_blob_sha": "f62cd413a41d34d706859eba27e29f82e5aa7eb3"},
    {"path": "src/model/Arrangement.h", "git_blob_sha": "1692c085cfb8c5e561ed1e08291883e0c17db0d9"},
    {"path": "src/model/Project.h", "git_blob_sha": "02a357719a4d3ca82356a355f9bef6bf2051fc40"},
    {"path": "src/model/Track.h", "git_blob_sha": "4dd48d4ab90412bf4fb77bbf5e668d80ae2a0135"},
    {"path": "src/model/LaneVersion.h", "git_blob_sha": "87f9709b1ed977f121ef8877e0847d8c39a19b23"},
    {"path": "src/model/TrackVersionService.h", "git_blob_sha": "63f51af2905f9520bf8f723f41c9a272a19a2faa"},
    {"path": "src/utils/UndoSystem.h", "git_blob_sha": "471fc0ef3bf81eac008436c77393ac6a6804a477"},
    {"path": "src/vim/ActionRegistry.h", "git_blob_sha": "786e82bab6fbcef3c31031459ad77aa897daf631"},
    {"path": "src/vim/ContextAdapter.h", "git_blob_sha": "b6a4f9142dae45b73e307ca0b96e0da9f3b21724"},
    {"path": "src/vim/KeymapRegistry.h", "git_blob_sha": "aef766fa31182af4848c842ff4ff9909aa4da0e0"},
    {"path": "src/vim/KeySequence.h", "git_blob_sha": "d3c844cb452f966311f038b499af69e4d179cf42"},
    {"path": "src/vim/VimContext.h", "git_blob_sha": "c143f3153588cfaf0a04cfd4027b25c37dd76068"},
    {"path": "tests/helpers/VimTestFixture.h", "git_blob_sha": "f68811ee09ec2493b3f1dac19ca9ff0cb0625f47"}
  ], "seed_patch": "../seeds/case-06-bad-artifact-861eebff.patch", "seed_patch_sha256": "11a66e017a58ce3fe81a716d7255dd480f49ea5b2fd598102fce9ba44e7d7e05"},
  "read_paths": ["tests/integration/LaneVersionCommandTest.cpp", "tests/helpers/VimTestFixture.h", "src/vim/adapters/EditorAdapter.h", "src/vim/adapters/EditorAdapter.cpp", "src/vim/adapters/fragments/EditorAdapterActionHandlers.inc", "src/vim/adapters/fragments/EditorAdapterTakeActions.inc", "src/vim/adapters/fragments/EditorAdapterActionRegistration.inc", "src/model/Arrangement.h", "src/model/Project.h", "src/model/Track.h", "src/model/LaneVersion.h", "src/model/TrackVersionService.h", "src/utils/UndoSystem.h", "src/vim/ActionRegistry.h", "src/vim/ContextAdapter.h", "src/vim/KeymapRegistry.h", "src/vim/KeySequence.h", "src/vim/VimContext.h"],
  "write_paths": ["tests/integration/LaneVersionCommandTest.cpp", "src/vim/adapters/EditorAdapter.h", "src/vim/adapters/EditorAdapter.cpp", "src/vim/adapters/fragments/EditorAdapterActionHandlers.inc", "src/vim/adapters/fragments/EditorAdapterTakeActions.inc", "src/vim/adapters/fragments/EditorAdapterActionRegistration.inc"],
  "required_changed_paths": ["tests/integration/LaneVersionCommandTest.cpp", "src/vim/adapters/EditorAdapter.h", "src/vim/adapters/EditorAdapter.cpp", "src/vim/adapters/fragments/EditorAdapterTakeActions.inc", "src/vim/adapters/fragments/EditorAdapterActionRegistration.inc"],
  "result_artifact": "",
  "required_mutation": true,
  "oracle_id": "take-cycling-bad-artifact-861eebff-v1",
  "oracle_artifacts": [
    {"path": "take-cycling-canonical-tests.patch", "sha256": "9f532bd3958d00ee4637cea4ae2f2088ea6940b82ae4044da601e172d9af698f"},
    {"path": "take-cycling-canonical-implementation.patch", "sha256": "247a217b09f63f634f6ce22ce726d9386d3ba19eac243fe74c08d64a5992511a"},
    {"path": "take-cycling-mutants.json", "sha256": "28116d85ce8941d7612c82d667a950ce8dc57a3fa4f3e994da881d0f5759b79f"},
    {"path": "take-cycling-bad-artifact-diagnostics.txt", "sha256": "94fb987c2a127b9c3a824a481649d8f319877c6af48dcda634e24bc47459b546"}
  ],
  "budget": {"max_input_tokens": 75000, "max_output_tokens": 8000, "max_tool_calls": 24, "max_iterations": 24, "timeout_seconds": 720}
}
