{
  "schema": "canvasbench.task.v2",
  "id": "case-05",
  "title": "Multi-file take-cycling implementation",
  "description": "Implement the frozen take-cycling contract from an orchestration-compiled member/API contract against content-addressed hidden red tests.",
  "status": "runnable",
  "mode": "direct_worker",
  "inference_policy": "required",
  "allowed_tool_policies": ["structured_only", "sandboxed_shell"],
  "weight": 16,
  "role": "coder",
  "system_prompt": "You are the implementation phase of a compiled orchestration manifest. Implement only the declared EditorAdapter header, implementation include seam, focused take-actions fragment, and action registration fragment. The upstream evidence and test phases froze the member/API contract below; use it exactly and do not rediscover or invent getters. Put takeNext(int), takePrev(int), and cycleSelectedTake(int) private member definitions in the new EditorAdapterTakeActions.inc; do not grow EditorAdapterActionHandlers.inc or create a free helper. Stop after the implementation artifact is complete.",
  "user_message": "Implement forward/backward wrap, audio-only validation, no-op handling, status, context notification, and one-step undo against the frozen hidden red tests.\n\nCompiled member/API contract:\n- Declare exactly three private EditorAdapter members: void takeNext(int), void takePrev(int), and void cycleSelectedTake(int).\n- Include fragments/EditorAdapterTakeActions.inc from EditorAdapter.cpp immediately before action registration.\n- Use the existing EditorAdapter members arrangement, project, onStatusMessage, and onContextChanged directly; do not invent getArrangement(), getProject(), getContext(), or setStatusMessage().\n- Obtain the selected track with arrangement.getSelectedTrackIndex(), validate it against arrangement.getNumTracks(), then construct Track(arrangement.getTrack(trackIndex)).\n- Accept only TrackType::Audio with more than one clip-lane version.\n- Perform cycling through TrackVersionService(project).cycle({trackIndex}, trackIndex, delta, &project.getUndoManager()) inside one ScopedTransaction(project.getUndoSystem(), \"Cycle Take\").\n- Read the resulting name from LaneVersion(Track(arrangement.getTrack(trackIndex)).getActiveClipLaneVersion()).getName().\n- Register take.next and take.prev as member pointers in EditorAdapterActionRegistration.inc.",
  "fixture": {"repo_id": "drem-canvas", "base_commit": "da8d567ea85a6ffc08e7a1ec0d3d7e49802306fc", "visible_blobs": [
    {"path": "src/vim/adapters/EditorAdapter.h", "git_blob_sha": "f317c4391fcf48cc4e496a06231f1661f7489871"},
    {"path": "src/vim/adapters/EditorAdapter.cpp", "git_blob_sha": "ccbda6a4d6b97265b36424412ace222c7051674b"},
    {"path": "src/vim/adapters/fragments/EditorAdapterActionHandlers.inc", "git_blob_sha": "42a9aae475fdd7cb8e8a572d3c716e3bb5f51fc6"},
    {"path": "src/vim/adapters/fragments/EditorAdapterActionRegistration.inc", "git_blob_sha": "f62cd413a41d34d706859eba27e29f82e5aa7eb3"},
    {"path": "src/model/TrackVersionService.h", "git_blob_sha": "63f51af2905f9520bf8f723f41c9a272a19a2faa"},
    {"path": "src/model/TrackVersionService.cpp", "git_blob_sha": "2f51e05e6d8466c922045495d83096eb6be8ad63"},
    {"path": "src/model/Track.h", "git_blob_sha": "4dd48d4ab90412bf4fb77bbf5e668d80ae2a0135"},
    {"path": "src/model/LaneVersion.h", "git_blob_sha": "87f9709b1ed977f121ef8877e0847d8c39a19b23"},
    {"path": "src/model/Arrangement.h", "git_blob_sha": "1692c085cfb8c5e561ed1e08291883e0c17db0d9"},
    {"path": "src/model/Project.h", "git_blob_sha": "02a357719a4d3ca82356a355f9bef6bf2051fc40"},
    {"path": "src/utils/UndoSystem.h", "git_blob_sha": "471fc0ef3bf81eac008436c77393ac6a6804a477"},
    {"path": "src/vim/ActionRegistry.h", "git_blob_sha": "786e82bab6fbcef3c31031459ad77aa897daf631"},
    {"path": "src/vim/ContextAdapter.h", "git_blob_sha": "b6a4f9142dae45b73e307ca0b96e0da9f3b21724"},
    {"path": "src/vim/VimContext.h", "git_blob_sha": "c143f3153588cfaf0a04cfd4027b25c37dd76068"}
  ]},
  "read_paths": ["src/model/TrackVersionService.h", "src/model/Track.h", "src/model/LaneVersion.h", "src/utils/UndoSystem.h"],
  "write_paths": ["src/vim/adapters/EditorAdapter.h", "src/vim/adapters/EditorAdapter.cpp", "src/vim/adapters/fragments/EditorAdapterTakeActions.inc", "src/vim/adapters/fragments/EditorAdapterActionRegistration.inc"],
  "required_changed_paths": ["src/vim/adapters/EditorAdapter.h", "src/vim/adapters/EditorAdapter.cpp", "src/vim/adapters/fragments/EditorAdapterTakeActions.inc", "src/vim/adapters/fragments/EditorAdapterActionRegistration.inc"],
  "result_artifact": "",
  "required_mutation": true,
  "oracle_id": "take-cycling-implementation-canonical-v1",
  "oracle_artifacts": [
    {"path": "take-cycling-canonical-tests.patch", "sha256": "9f532bd3958d00ee4637cea4ae2f2088ea6940b82ae4044da601e172d9af698f"},
    {"path": "take-cycling-canonical-implementation.patch", "sha256": "247a217b09f63f634f6ce22ce726d9386d3ba19eac243fe74c08d64a5992511a"}
  ],
  "budget": {"max_input_tokens": 65000, "max_output_tokens": 7000, "max_tool_calls": 22, "max_iterations": 22, "timeout_seconds": 600}
}
