{
  "schema": "canvasbench.task.v2",
  "id": "case-02",
  "title": "Real one-file LowerZoneState repair",
  "description": "Repair the seeded upper-clamp regression in the real Canvas header.",
  "status": "runnable",
  "mode": "direct_worker",
  "inference_policy": "required",
  "allowed_tool_policies": ["structured_only", "sandboxed_shell"],
  "weight": 7,
  "role": "fixer",
  "system_prompt": "Repair one seeded regression. Read only the declared files, edit only src/model/LowerZoneState.h, preserve all unrelated behavior, and stop after the change.",
  "user_message": "setArrangementShare must constrain every value to the declared minimum and maximum; restore the smallest correct C++17 implementation.",
  "fixture": {
    "repo_id": "drem-canvas",
    "base_commit": "da8d567ea85a6ffc08e7a1ec0d3d7e49802306fc",
    "visible_blobs": [
      {"path": "src/model/LowerZoneState.h", "git_blob_sha": "3418767f45bf6624fac1eef3707b9f7c6aa10fc4"},
      {"path": "tests/unit/model_layer/test_lower_zone_state.cpp", "git_blob_sha": "30b051a6f239abcfda13c47c70e327e571f6eef2"}
    ],
    "seed_patch": "../seeds/case-02-lower-zone.patch",
    "seed_patch_sha256": "f41c4740aee68e7880fea0b389fb344185179aaf854b0e1b46d625cd4461b4c2"
  },
  "read_paths": ["src/model/LowerZoneState.h", "tests/unit/model_layer/test_lower_zone_state.cpp"],
  "write_paths": ["src/model/LowerZoneState.h"],
  "required_changed_paths": ["src/model/LowerZoneState.h"],
  "result_artifact": "",
  "required_mutation": true,
  "oracle_id": "lower-zone-clamp-v1",
  "budget": {"max_input_tokens": 15000, "max_output_tokens": 1500, "max_tool_calls": 8, "max_iterations": 8, "timeout_seconds": 120}
}
